{
  "saved": true,
  "changed": true,
  "document_id": "ref:codex-user-config",
  "previous_content_hash": "absent",
  "document_revision": "sha256:0000000000000000000000000000000000000000000000000000000000000000",
  "backup": null,
  "application_effects": [
    "future_session"
  ],
  "context_revision": "ctx-001"
}
